Word,Translation,Context,Source,Source Translation
བསླབ་པ་,learn,རྒྱལ་སྲས་རྣམས་ཀྱིས་མི་བསླབ་པ། །དེ་ནི་གང་ཡང་ཡོད་མིན་ཏེ། །,རྒྱལ་སྲས་རྣམས་ཀྱིས་མི་བསླབ་པ། །དེ་ནི་གང་ཡང་ཡོད་མིན་ཏེ། །དེ་ལྟར་གནས་པའི་མཁས་པ་ལ། །བསོད་ནམས་མི་འགྱུར་གང་ཡང་མེད། །,"There is nothing that the sons of the conquerors should not learn.
For the wise ones who abide in such a way,
There is nothing that does not become meritorious."
བསླབ་པ་,Training,བསླབ་པ་ཀུན་ལས་བཏུས་པ་ཡང་། །,གང་ཕྱིར་རྟག་ཏུ་སྤྱད་པ་ནི། །དེ་ལས་རྒྱ་ཆེར་རབ་སྟོན་པས། །བསླབ་པ་ཀུན་ལས་བཏུས་པ་ཡང་། །ངེས་པར་ཡང་དང་ཡང་དུ་བལྟ། །,"Because the constant practice [of bodhisattvas] is extensively taught therein, one should definitely look again and again at the Compendium of Training."
བསྐྱེད་,generate,བྱང་ཆུབ་སེམས་ནི་བསྐྱེད་བགྱི་ཞིང་། །,དེ་བཞིན་འགྲོ་ལ་ཕན་དོན་དུ། །བྱང་ཆུབ་སེམས་ནི་བསྐྱེད་བགྱི་ཞིང་། །དེ་བཞིན་དུ་ནི་བསླབ་པ་ལའང་། །རིམ་པ་བཞིན་དུ་བསླབ་པར་བགྱི། །,"Likewise, for the benefit of beings,
I will generate the mind of enlightenment.
And similarly, in the trainings as well,
I will train step by step."
བསྐྱེད་,generated,མོས་པ་སྡུག་བསྔལ་འཇིགས་པ་དང་། །དེ་ཡི་ཕན་ཡོན་བསམ་པས་བསྐྱེད། །,སེམས་ཅན་དོན་གྲུབ་བྱ་ཕྱིར་དཔུང་། །མོས་བརྟན་དགའ་དང་དོར་བ་ཡིན། །མོས་པ་སྡུག་བསྔལ་འཇིགས་པ་དང་། །དེ་ཡི་ཕན་ཡོན་བསམ་པས་བསྐྱེད། །,"In order to accomplish the welfare of beings, the forces are
Aspiration, steadfastness, joy, and relinquishing.
Aspiration is generated by contemplating
The fears of suffering and its benefits."
བསྐྱེད་,produced,སྡུག་བསྔལ་འབའ་ཞིག་བསྐྱེད་པར་ཟད། །,འཇིགས་ལ་མི་འཇིགས་མ་བྱིན་དང་། །ཉམ་ཐག་བདེ་མ་བྱིན་ན་བདག །མ་ཡི་མངལ་གྱི་ཟུག་རྔུ་དང་། །སྡུག་བསྔལ་འབའ་ཞིག་བསྐྱེད་པར་ཟད། །,"If I do not give fearlessness to the fearful,
And do not bring happiness to the suffering,
I will have merely produced
The pain and suffering of a mother's womb."
བསྐྱེད་,cultivate,དབེན་པ་ལ་ནི་དགའ་བ་བསྐྱེད། །,དེ་ལྟར་འདོད་ལ་སྐྱོ་བྱས་ཏེ། །དབེན་པ་ལ་ནི་དགའ་བ་བསྐྱེད། །རྩོད་དང་ཉོན་མོངས་ཀྱིས་སྟོང་པ། །ཞི་བའི་ནགས་ཀྱི་ནང་དག་ཏུ། །,"Thus, having grown weary of desires,
Cultivate joy in seclusion.
In the depths of peaceful forests,
Devoid of conflicts and afflictions."
བསྐྱེད་,produce,དེས་བསྐྱེད་འདོད་པའང་གང་ཞིག་ཡིན། །,དེས་བསྐྱེད་འདོད་པའང་གང་ཞིག་ཡིན། །བདག་ནི་དེ་དང་ས་སོགས་དང་། །དབང་ཕྱུག་ངོ་བོའང་རྟག་མིན་ནམ། །ཤེས་པ་ཤེས་བྱ་ལས་སྐྱེ་དང་། །,"What does that [Ishvara] desire to produce?
Are not the self, the elements and such,
And the nature of Ishvara himself permanent?
Consciousness arises from objects of knowledge and [previous moments]."
ཐོབ་,obtained,མི་ཡི་སྲིད་པ་ལེགས་པར་ཐོབ། །,དེང་དུ་བདག་ཚེ་འབྲས་བུ་ཡོད། །མི་ཡི་སྲིད་པ་ལེགས་པར་ཐོབ། །དི་རིང་སངས་རྒྱས་རིགས་སུ་སྐྱེས། །སངས་རྒྱས་སྲས་སུ་བདག་དེང་གྱུར། །,"Today, my life has become fruitful.
I have excellently obtained a human existence.
Today, I am born into the Buddha's family.
Now, I have become a child of the Buddha."
ཐོབ་,acquire,རྙེད་པ་མང་པོ་ཐོབ་གྱུར་ཏེ།,རྙེད་པ་མང་པོ་ཐོབ་གྱུར་ཏེ། །ཡུན་རིང་དུས་སུ་བདེ་སྤྱད་ཀྱང་། །ཆོམ་པོས་ཕྲོགས་པ་ཇི་བཞིན་དུ། །སྒྲེན་མོ་ལག་པ་སྟོང་པར་འགྲོ། །,"Though one may acquire many possessions
And enjoy them for a long time,
Just as if robbed by thieves,
One departs naked, empty-handed."
ཐོབ་,attaining,།འཁོར་ལོས་སྒྱུར་བའི་བདེ་རྒྱས་ཐོབ།,འཁོར་ཚེ་བཟོད་པས་མཛེས་སོགས་དང་། །ནད་མེད་པ་དང་གྲགས་པ་ཡིས། །ཤིན་ཏུ་ཡུན་རིང་འཚོ་བ་དང་། །འཁོར་ལོས་སྒྱུར་བའི་བདེ་རྒྱས་ཐོབ། །,"While cycling through rebirths, through patience one becomes beautiful and so forth,
Free from illness and renowned,
Living for an extremely long time,
And attaining the expansive bliss of a universal monarch."
ཐོབ་,obtain,བདག་གི་དགེ་བའི་སྟོབས་ཀྱིས་ལྷ་ཡི་ལུས་ཐོབ་ནས། །,ཆུ་བོ་རབ་མེད་མེ་དོང་འདྲ་ནང་བྱིང་བ་དག །ཤ་ཀུན་ཞིག་གྱུར་རུས་གོང་མེ་ཏོག་ཀུནྡའི་མདོག །བདག་གི་དགེ་བའི་སྟོབས་ཀྱིས་ལྷ་ཡི་ལུས་ཐོབ་ནས། །ལྷ་མོ་རྣམས་དང་ལྷན་ཅིག་དལ་གྱིས་འབབ་གནས་ཤོག །,"Those who have sunk into a river of hell fire where no rafts exist,
Their flesh decayed, bones white as kunda flowers,
May they, by the power of my virtue, obtain divine bodies,
And dwell with goddesses by gently flowing streams."
ཐོབ་,find,མྱ་ངན་ཉམ་ཐག་དགའ་ཐོབ་ཤོག །,བཀྲེན་པ་རྣམས་ཀྱིས་ནོར་ཐོབ་ཤོག །མྱ་ངན་ཉམ་ཐག་དགའ་ཐོབ་ཤོག །ཡི་ཆད་རྣམས་ཀྱང་ཡིད་སོས་ཤིང་། །བརྟན་པ་ཕུན་སུམ་ཚོགས་པར་ཤོག །,"May the poor obtain wealth.
May the sorrowful and miserable find joy.
May even the despondent be uplifted in spirit.
And may they all achieve perfect, unwavering stability."
རིགས་,logical,དེ་ལ་བརྟེན་ནས་སྡུག་བསྔལ་རྣམས། །རྒྱུན་ཆད་འགྱུར་འདོད་མི་རིགས་མེད། །,གང་གིས་གང་ཞིག་བཟློག་བྱ་སྟེ། །བཟློག་པའང་རིགས་པ་མིན་ཞེ་ན། །དེ་ལ་བརྟེན་ནས་སྡུག་བསྔལ་རྣམས། །རྒྱུན་ཆད་འགྱུར་འདོད་མི་རིགས་མེད། །,"If one asks: ""By what means should what be stopped? Stopping [negative states] is not logical.""
[The response is:] There is nothing illogical in desiring that, based on this [conventional stopping], the continuum of sufferings will be cut off."
རིགས་,appropriate,ཉེས་ན་ཞེ་སྡང་ལ་ཁྲོ་རིགས། །,དབྱུག་པ་ལ་སོགས་དངོས་བཀོལ་ཏེ། །གལ་ཏེ་འཕེན་པ་ལ་ཁྲོ་ན། །དེ་ཡང་ཞེ་སྡང་གིས་སྦད་པས། །ཉེས་ན་ཞེ་སྡང་ལ་ཁྲོ་རིགས། །,"If one uses sticks and other objects as weapons,
And you become angry at the one who throws them,
Since they too are driven by anger,
It is more appropriate to be angry at anger itself."
རིགས་,fitting,།དེ་བས་སེམས་ཅན་འཚེ་བྱེད་པ། །བདག་ལ་གནོད་པ་འདི་འབྱུང་རིགས།,བདག་གིས་སྔོན་ཆད་སེམས་ཅན་ལ། །འདི་འདྲ་བ་ཡི་གནོད་པ་བྱས། །དེ་བས་སེམས་ཅན་འཚེ་བྱེད་པ། །བདག་ལ་གནོད་པ་འདི་འབྱུང་རིགས། །,"In the past, I have inflicted such harm on sentient beings.
Therefore, it is fitting that this harm now comes to me,
Who has injured sentient beings."
རིགས་,lineage,བདག་ལྟ་རིགས་ཀྱིས་མིར་སྐྱེས་ལ། །,བདག་ལྟ་རིགས་ཀྱིས་མིར་སྐྱེས་ལ། །ཕན་དང་གནོད་པའི་ངོ་ཤེས་པས། །བྱང་ཆུབ་སྤྱོད་པ་མ་བཏང་ན། །བདག་གིས་བྱང་ཆུབ་ཅིས་མི་འཐོབ། །,"Having been born human with a noble lineage like myself,
And understanding what is beneficial and harmful,
If I do not abandon the conduct of enlightenment,
How could I not attain enlightenment?"
རིགས་,social status,འདི་དག་ཐོས་དང་ཤེས་རབ་བམ། །གཟུགས་རིགས་ནོར་གྱིས་མཉམ་མམ་ཅི། །,ཉོན་མོངས་འདི་ཡང་བདག་དང་ནི། །ལྷན་ཅིག་ཏུ་ནི་འགྲན་ཅེས་གྲག །འདི་དག་ཐོས་དང་ཤེས་རབ་བམ། །གཟུགས་རིགས་ནོར་གྱིས་མཉམ་མམ་ཅི། །,"These afflictions are said to compete with me.
Are they truly equal to me in learning and wisdom?
Or in physical appearance, social status, or wealth?"
བྱུང་བ་,emerges,དམ་ཆོས་འོ་མ་བསྲུབས་པ་ལས། །མར་གྱི་ཉིང་ཁུ་བྱུང་བ་ཡིན། །,འགྲོ་བའི་མི་ཤེས་རབ་རིབ་དག །དཔྱིས་འབྱིན་ཉི་མ་ཆེན་པོ་ཡིན། །དམ་ཆོས་འོ་མ་བསྲུབས་པ་ལས། །མར་གྱི་ཉིང་ཁུ་བྱུང་བ་ཡིན། །,"It is the great sun that thoroughly dispels
The cataracts of beings' ignorance.
It is the butter essence that emerges
From churning the milk of the holy Dharma."
བྱུང་བ་,arise,།སེམས་ལས་བྱུང་བ་ཡིན་ནོ་ཞེས། །ཡང་དག་གསུང་བ་ཉིད་ཀྱིས་བསྟན།,འདི་ལྟར་འཇིགས་པ་ཐམས་ཅད་དང་། །སྡུག་བསྔལ་དཔག་ཏུ་མེད་པ་ཡང་། །སེམས་ལས་བྱུང་བ་ཡིན་ནོ་ཞེས། །ཡང་དག་གསུང་བ་ཉིད་ཀྱིས་བསྟན། །,"Thus, all fears and immeasurable sufferings
Arise from the mind, as taught
By the One who speaks the perfect truth."
བྱུང་བ་,occurs,ཉེས་པ་བྱུང་བ་རེ་རེ་ཞིང་། །,ཉེས་པ་བྱུང་བ་རེ་རེ་ཞིང་། །བདག་ལ་སྨད་ནས་ཅི་ནས་ཀྱང་། །བདག་ལ་ཕྱིས་འདི་མི་འབྱུང་བ། །དེ་ལྟར་བྱ་ཞེས་ཡུན་རིང་བསམ། །,"For each mistake that occurs,
Having criticized myself, by all means,
So that this does not happen to me again in the future,
I will think long and hard about how to act."
བྱུང་བ་,arisen,ལུས་འདི་གཅིག་པུ་བྱུང་བ་ཡང་། །,ལུས་འདི་གཅིག་པུ་བྱུང་བ་ཡང་། །ལྷན་ཅིག་སྐྱེས་པའི་ཤ་རུས་དག །ཞིག་སྟེ་སོ་སོར་འགྱེས་འགྱུར་ན། །མཛའ་བ་གཞན་དག་ཅི་ཞིག་སྨོས། །,"Even this single body that has arisen,
With its flesh and bones born together as one,
Will decay and separate into parts.
What need is there to speak of other friends?"
བྱུང་བ་,originate,གང་ལས་དེ་ནི་བྱུང་བ་ཡི། །,ས་ཕྱོགས་མི་གཙང་གིས་གོས་པ། །གལ་ཏེ་རེག་པར་མི་འདོད་ན། །གང་ལས་དེ་ནི་བྱུང་བ་ཡི། །ལུས་ལ་ཇི་ལྟར་ཁྱོད་རེག་འདོད། །,"If you do not wish to touch
A place on the ground stained with impurities,
How can you desire to touch the body,
From which those impurities originate?"
བྱུང་བ་,arising,སྣ་ཚོགས་རྐྱེན་ལས་བྱུང་བ་ཡི། །,སྔགས་སོགས་རྣམས་ལ་ནུས་མེད་ཕྱིར། །སྒྱུ་མའི་སེམས་ནི་འབྱུང་བ་མེད། །སྣ་ཚོགས་རྐྱེན་ལས་བྱུང་བ་ཡི། །སྒྱུ་མ་དེ་ཡང་སྣ་ཚོགས་ཉིད། །,"Since mantras and such lack the power [to produce mind],
Illusory mind does not arise [from them].
[However,] illusions arising from various conditions
Are themselves of various kinds."
བྱུང་བ་,arises,རྣམ་བརྟགས་ཞིང་ལས་བྱུང་བ་ཡི། །བསམ་གཏན་རྣལ་འབྱོར་པ་ཡི་ཟས། །,དེ་ཉིད་ཕྱིར་ན་འདི་ཡི་ནི། །གཉེན་པོ་རྣམ་དཔྱོད་འདི་བསྒོམ་སྟེ། །རྣམ་བརྟགས་ཞིང་ལས་བྱུང་བ་ཡི། །བསམ་གཏན་རྣལ་འབྱོར་པ་ཡི་ཟས། །,"Therefore, as an antidote to this,
One should cultivate discerning wisdom.
From the field of thorough investigation
Arises meditative concentration, the yogi's nourishment."
དངོས་པོ་,thing,དངོས་པོ་ཕལ་པ་ཅུང་ཟད་ལའང་། །,དངོས་པོ་ཕལ་པ་ཅུང་ཟད་ལའང་། །ཡིད་ཀྱིས་སྦྱིན་པར་བསམ་བྱས་ནས། །མི་གང་སྦྱིན་པར་མི་བྱེད་པ། །དེ་ཡང་ཡི་དགས་འགྱུར་གསུངས་ན། །,"Even for the smallest ordinary thing,
If one thinks in their mind to give it away,
But then does not actually give it,
It is said they will become a hungry ghost."
དངོས་པོ་,phenomenon,དངོས་པོ་ཀུན་ལ་ཁྲོ་མི་འགྱུར། །,དེ་ལྟར་ཐམས་ཅད་གཞན་གྱི་དབང་། །དེ་ཡི་དབང་གིས་དེ་དབང་མེད། །དེ་ལྟར་ཤེས་ན་སྦྲུལ་ལྟ་བུའི། །དངོས་པོ་ཀུན་ལ་ཁྲོ་མི་འགྱུར། །,"Thus, everything is dependent on others.
Due to this dependence, they have no independence.
Understanding this, one does not become angry
At any phenomenon, which is like an illusion."
དངོས་པོ་,real existence,གཞན་མིན་ཞེ་ན་དངོས་པོར་མེད། །,སེམས་ལས་སྒྱུ་མ་གཞན་མིན་ཞིང་། །གཞན་མིན་པར་ཡང་མི་རྟག་ན། །དངོས་ན་ཇི་ལྟར་དེ་གཞན་མིན། །གཞན་མིན་ཞེ་ན་དངོས་པོར་མེད། །,"Illusions are not other than mind,
Yet they're not non-other and impermanent.
If they were real, how could they be not other?
If not other, then they have no real existence."
དངོས་པོ་,object,གང་ཚེ་གང་ཞིག་མེད་དོ་ཞེས། །བརྟག་བྱའི་དངོས་པོ་མི་དམིགས་པ། །,གང་ཚེ་གང་ཞིག་མེད་དོ་ཞེས། །བརྟག་བྱའི་དངོས་པོ་མི་དམིགས་པ། །དེ་ཚེ་དངོས་མེད་རྟེན་བྲལ་བ། །བློ་ཡི་མདུན་ན་ཇི་ལྟར་གནས། །,"When something is said not to exist,
And the object to be examined is not perceived,
How then can non-existence, devoid of support,
Stand before the mind?"
དངོས་པོ་,exist,ཚོགས་པའང་དངོས་པོ་མེད་ཕྱིར་ཏེ། །སྔར་ནི་ཇི་ལྟར་རྣམ་དཔྱད་བཞིན། །,རྣམ་ཤེས་ལུས་མེད་པ་ལ་ནི། །ཕྲད་པ་འཐད་པ་མ་ཡིན་ཉིད། །ཚོགས་པའང་དངོས་པོ་མེད་ཕྱིར་ཏེ། །སྔར་ནི་ཇི་ལྟར་རྣམ་དཔྱད་བཞིན། །,"For consciousness, which has no body,
Contact is indeed not possible.
Aggregation too does not truly exist,
As previously analyzed in detail."
དངོས་པོ་,things,དངོས་པོ་རྣམ་དཔྱད་མ་ཟིན་ནམ། །,དངོས་རྣམས་དེ་རྒྱུའི་རང་བཞིན་ན། །དངོས་པོ་རྣམ་དཔྱད་མ་ཟིन་ནམ། །ཁྱོད་ཀྱི་རྒྱུ་ཡང་བདེ་སོགས་ཉིད། །དེ་ལས་སྣམ་སོགས་འབྱུང་བའང་མེད། །,"Things exist in the nature of their causes.
Have you not examined things thoroughly?
Your causes are also happiness and so forth.
From that, cloth and such do not arise."
དངོས་པོ་,phenomena,།དེ་བཞིན་དངོས་པོ་ཐམས་ཅད་ནི།,རགས་པ་དོར་ནས་ཕྲ་གྱུར་པས། །ཕྲ་རགས་དེ་དག་མི་རྟག་ཉིད། །དེ་བཞིན་དངོས་པོ་ཐམས་ཅད་ནི། །མི་རྟག་ཉིད་དུ་ཅིས་མི་འདོད། །,"When the coarse is abandoned and becomes subtle,
Both coarse and subtle are impermanent.
Likewise, why not accept
That all phenomena are impermanent?"
དངོས་པོ་,that which,དངོས་པོ་ཡོད་པར་གྱུར་པ་ལ། །རྒྱུ་ཡིས་དགོས་པ་ཅི་ཞིག་ཡོད།,དངོས་པོ་ཡོད་པར་གྱུར་པ་ལ། །རྒྱུ་ཡིས་དགོས་པ་ཅི་ཞིག་ཡོད། །འོན་ཏེ་དེ་ནི་མེད་ན་ཡང་། །རྒྱུ་ཡིས་དགོས་པ་ཅི་ཞིག་ཡོད། །,"For that which already exists,
What need is there for a cause?
And if it does not exist,
What use is there for a cause?"
དངོས་པོ་,entities,མེད་ཚེ་དངོས་ཡོད་སྲིད་མིན་ན། །དངོས་པོ་ཡོད་པར་ནམ་ཞིག་འགྱུར། །,མེད་ཚེ་དངོས་ཡོད་སྲིད་མིན་ན། །དངོས་པོ་ཡོད་པར་ནམ་ཞིག་འགྱུར། །དངོས་པོ་སྐྱེས་པར་མ་གྱུར་པར། །དངོས་མེད་དེ་ནི་འབྲལ་མི་འགྱུར། །,"If in the absence [of entities], real existence is impossible,
How could entities ever come to exist?
Without entities coming into being,
Non-existence cannot be separated [from them]."
དངོས་པོ་,existence,དངོས་པོ་ཡོད་པའི་སྐབས་མི་སྲིད། །,དངོས་མེད་དང་ནི་མ་བྲལ་ན། །དངོས་པོ་ཡོད་པའི་སྐབས་མི་སྲིད། །དངོས་པོའང་མེད་པར་འགྱུར་མིན་ཏེ། །རང་བཞིན་གཉིས་སུ་ཐལ་འགྱུར་ཕྱིར། །,"If not separated from non-existence,
The occasion for existence is impossible.
Nor can existence become non-existence,
For this would absurdly imply two natures."
བསམ་,think,ཡིད་ཀྱིས་སྦྱིན་པར་བསམ་བྱས་ནས། །,དངོས་པོ་ཕལ་པ་ཅུང་ཟད་ལའང་། །ཡིད་ཀྱིས་སྦྱིན་པར་བསམ་བྱས་ནས། །མི་གང་སྦྱིན་པར་མི་བྱེད་པ། །དེ་ཡང་ཡི་དགས་འགྱུར་གསུངས་ན། །,"Even for the smallest ordinary thing,
If one thinks in their mind to give it away,
But then does not actually give it,
It is said they will become a hungry ghost."
བསམ་,consider,།གཙོ་ཆེར་གཞན་གྱི་དོན་བསམ་མོ།,སྦྱིན་པའི་ཕ་རོལ་ཕྱིན་ལ་སོགས། །གོང་ནས་གོང་དུ་ཁྱད་ཞུགས་སྤྱད། །ཆུང་ངུའི་ཕྱིར་ནི་ཆེ་མི་གཏང་། །གཙོ་ཆེར་གཞན་གྱི་དོན་བསམ་མོ། །,"Practice the perfections such as generosity with increasing excellence.
Do not abandon the greater for the sake of the lesser.
Primarily consider the welfare of others."
བསམ་,intentions,གལ་ཏེ་དགྲ་འདི་གནོད་བྱ་བའི། །བསམ་ཡོད་མཆོད་བྱ་མིན་ཞེ་ན། །,གལ་ཏེ་དགྲ་འདི་གནོད་བྱ་བའི། །བསམ་ཡོད་མཆོད་བྱ་མིན་ཞེ་ན། །སྨན་པ་བཞིན་དུ་ཕན་བརྩོན་ན། །བདག་གི་བཟོད་པ་ཇི་ལྟར་འགྲུབ། །,"If you say this enemy should not be honored due to harmful intentions,
Then, if I strive to benefit like a physician,
How can I accomplish my patience?"
བསམ་,contemplating,དམྱལ་སོགས་སྡུག་བསྔལ་བསམ་བྱས་ན།,དམྱལ་སོགས་སྡུག་བསྔལ་བསམ་བྱས་ན། །འདོད་པ་རྣམས་ལ་མཚོན་དང་ནི། །དུག་དང་མེ་དང་གཡང་ས་དང་། །དགྲ་རྣམས་ཀྱིས་ཀྱང་དཔེར་མི་ཕོད། །,"When contemplating the sufferings of hell and other realms,
Even weapons, poison, fire, precipices,
And enemies cannot serve as adequate comparisons
For the sufferings caused by desires."
བསམ་,contemplated,དེ་ལ་སོགས་པའི་རྣམ་པ་ཡིས། །དབེན་པའི་ཡོན་ཏན་བསམ་བྱས་ནས། །,དེ་ལ་སོགས་པའི་རྣམ་པ་ཡིས། །དབེན་པའི་ཡོན་ཏན་བསམ་བྱས་ནས། །རྣམ་རྟོག་ཉེ་བར་ཞི་བ་དང་། །བྱང་ཆུབ་སེམས་ནི་བསྒོམ་པར་བྱ། །,"Having contemplated the qualities of solitude and such,
One should pacify nearby conceptual thoughts,
And then meditate on the mind of enlightenment."
