Word,Translation,Context,Source,Source Translation
གནོད་པ་,harmed,དེ་བཞིན་སེམས་ཅན་གནོད་པ་བྱས་ན་ཡང་། །,ཇི་ལྟར་ལུས་ལ་ཀུན་ནས་མེ་འབར་བ། །འདོད་པ་ཀུན་གྱིས་ཡིད་བདེར་མི་འགྱུར་བ། །དེ་བཞིན་སེམས་ཅན་གནོད་པ་བྱས་ན་ཡང་། །ཐུགས་རྗེ་ཆེ་རྣམས་དགྱེས་པའི་ཐབས་མེད་དོ། །,"Just as a body completely engulfed in flames
Cannot find pleasure in any sensual objects,
Likewise, when sentient beings are harmed,
There is no way for the greatly compassionate ones to be pleased."
གནོད་པ་,harmful,ཕན་དང་གནོད་པའི་ངོ་ཤེས་པས། །,བདག་ལྟ་རིགས་ཀྱིས་མིར་སྐྱེས་ལ། །ཕན་དང་གནོད་པའི་ངོ་ཤེས་པས། །བྱང་ཆུབ་སྤྱོད་པ་མ་བཏང་ན། །བདག་གིས་བྱང་ཆུབ་ཅིས་མི་འཐོབ། །,"Having been born human with a noble lineage like myself,
And understanding what is beneficial and harmful,
If I do not abandon the conduct of enlightenment,
How could I not attain enlightenment?"
མེད་པ་,"['no', 'without']",དེ་བདག་བྱེད་པ་མེད་པར་ཡང་། །,བྱ་བ་འབྲས་བཞི་ཐ་དད་དང་། །དེ་བདག་བྱེད་པ་མེད་པར་ཡང་། །ཡུ་བུ་གཉི་ག་ལ་གྲུབ་པས། །འདིར་བརྩད་དོན་མེད་མ་ཡིན་ནམ། །,"Given that actions and their four results are distinct,
And that there is no self performing these actions,
Both you and I agree on these points.
So, isn't our debate here meaningless?"
མེད་པ་,do not exist,འདས་དང་མ་འོངས་པ་ཡི་སེམས། །བདག་མིན་དེ་ནི་མེད་པའི་ཕྱིར། །,འདས་དང་མ་འོངས་པ་ཡི་སེམས། །བདག་མིན་དེ་ནི་མེད་པའི་ཕྱིར། །འོན་ཏེ་སྐྱེས་སེམས་བདག་ཡིན་ན། །དེ་ཞིག་ན་ཡང་བདག་མེད་དོ། །,"The minds of past and future are not the self, for they do not exist.
If one claims the arisen mind is the self,
When that ceases, there would be no self."
མེད་པ་,does not exist,ཕྱིས་དེ་ངེས་ན་དེ་ཡོད་དེ། །མིན་ན་ཀུན་རྫོབ་མེད་པ་ཉིད། །,འདི་ནི་གཞན་སེམས་རྣམ་རྟོག་སྟེ། །དེ་ནི་རང་གི་ཀུན་རྫོབ་མིན། །ཕྱིས་དེ་ངེས་ན་དེ་ཡོད་དེ། །མིན་ན་ཀུན་རྫོབ་མེད་པ་ཉིད། །,"This is the conceptual thought of others about [nirvana],
Which is not one's own conventional [truth] in [nirvana].
If later that [conceptual thought] is ascertained to exist, then it exists;
If not, then conventional [truth] itself does not exist."
མེད་པ་,non-existent,།བུ་མེད་པར་ནི་ཕ་མེད་པ། །དེ་བཞིན་དེ་གཉིས་མེད་པ་ཉིད། །,གལ་ཏེ་བུ་མེད་ཕ་མིན་ན། །བུ་ཉིད་གང་ལས་བྱུང་བ་ཡིན། །བུ་མེད་པར་ནི་ཕ་མེད་པ། །དེ་བཞིན་དེ་གཉིས་མེད་པ་ཉིད། །,"If there is no son, there is no father.
From where, then, did the son arise?
Without a son, there is no father;
Likewise, both are non-existent."
མེད་པ་,non-existence,གལ་ཏེ་མེད་པ་འགའ་ཡང་ནི། །,རགས་པ་བདེ་ལས་གཞན་མིན་ན། །བདེ་བ་གསལ་བ་མི་རྟག་ཉིད། །གལ་ཏེ་མེད་པ་འགའ་ཡང་ནི། །སྐྱེ་མིན་མེད་ཕྱིར་ཞེས་འདོད་ན། །,"If the coarse is not other than bliss,
Then bliss, like clarity, is impermanent.
If you assert that nothing whatsoever
Can arise from non-existence, as it does not exist,"
སྐྱེས་,born,དི་རིང་སངས་རྒྱས་རིགས་སུ་སྐྱེས། །,དེང་དུ་བདག་ཚེ་འབྲས་བུ་ཡོད། །མི་ཡི་སྲིད་པ་ལེགས་པར་ཐོབ། །དི་རིང་སངས་རྒྱས་རིགས་སུ་སྐྱེས། །སངས་རྒྱས་སྲས་སུ་བདག་དེང་གྱུར། །,"Today, my life has become fruitful.
I have excellently obtained a human existence.
Today, I am born into the Buddha's family.
Now, I have become a child of the Buddha."
སྐྱེས་,arisen,བྱང་ཆུབ་སེམས་འདི་བདག་ལ་སྐྱེས། །,ལོང་བས་ཕྱག་དང་ཕུང་པོ་ལས། །ཇི་ལྟར་རིན་ཆེན་རྙེད་པ་ལྟར། །དེ་བཞིན་ཇི་ཞིག་ལྟར་སྟེས་ནས། །བྱང་ཆུབ་སེམས་འདི་བདག་ལ་སྐྱེས། །,"Just as a blind person might somehow find a precious jewel
In a pile of swept-up dust,
So too, by some fortunate circumstance,
This mind of enlightenment has arisen in me."
སྐྱེས་,beings,ཤེས་ཉིད་ཅེ་ན་དེ་ལྟ་ན། །སྐྱེས་ཀུན་གཅིག་ཏུ་ཐལ་བར་འགྱུར། །,གལ་ཏེ་ཚུལ་གཞན་བདེན་མིན་ན། །དེ་ཡི་རང་གི་རང་བཞིན་སྨྲོས། །ཤེས་ཉིད་ཅེ་ན་དེ་ལྟ་ན། །སྐྱེས་ཀུན་གཅིག་ཏུ་ཐལ་བར་འགྱུར། །,"If there is no truth in the way things appear different,
Then state the inherent nature of that [oneness].
If you say it is mere consciousness,
Then it would absurdly follow that all beings are one."
སྐྱེས་,male,གང་ཚེ་དེ་ལྟར་ལུས་མེད་པ། །དེ་ཚེ་སྐྱེས་གང་བུད་མེད་གང་། །,དེ་ལྟར་རྨི་ལམ་ལྟ་བུ་ཡི། །གཟུགས་ལ་དཔྱོད་ལྡན་སུ་ཞིག་ཆགས། །གང་ཚེ་དེ་ལྟར་ལུས་མེད་པ། །དེ་ཚེ་སྐྱེས་གང་བུད་མེད་གང་། །,"Thus, who with discernment would be attached
To forms that are like a dream?
When there is no real body,
How can there be male or female?"
སྐྱེས་,arise,གལ་ཏེ་འགལ་རྐྱེན་སྐྱེས་པས་ན། །,གལ་ཏེ་འགལ་རྐྱེན་སྐྱེས་པས་ན། །སྡུག་བསྔལ་སྐྱེས་པ་མིན་ན་ནི། །ཚོར་བར་རྟོག་པ་མངོན་ཞེན་ཉིད། །ཡིན་ཞེས་བྱ་བར་གྲུབ་མིན་ནམ། །,"If when a contradictory condition arises,
It is not the case that suffering has arisen,
Is it not established that this is merely
Clinging to the concept of feeling?"
སྡིག་,negative actions,།བདག་གིས་མ་འཚལ་སྡིག་བགྱིས་པའམ།,ཐོག་མ་མེད་ལྡན་འཁོར་བ་ནས། །ཚེ་རབས་འདི་འམ་གཞན་དག་ཏུ། །བདག་གིས་མ་འཚལ་སྡིག་བགྱིས་པའམ། །བགྱིད་དུ་སྩལ་བ་ཉིད་དང་ནི། །,"From beginningless samsara,
In this life or in other lives,
The negative actions I have unknowingly committed,
Or caused others to commit,"
སྡིག་,sins,།དེ་དག་དོན་དུ་བྱས་པའི་སྡིག །མི་བཟད་གང་ཡིན་མདུན་ན་གནས།,རེ་ཞིག་གསོན་ཚེ་འདི་ཉིད་ལ། །མཛའ་དང་མི་མཛའ་དུ་མ་འདས། །དེ་དག་དོན་དུ་བྱས་པའི་སྡིག །མི་བཟད་གང་ཡིན་མདུན་ན་གནས། །,"Even in this very lifetime, many friends and foes have passed away.
The unbearable sins committed for their sake
Now stand before us, waiting."
སྡིག་,negativity,ཐོག་མེད་འཁོར་བར་བསགས་སྡིག་གིས། །བདེ་འགྲོར་མི་འགྲོ་སྨོས་ཅི་དགོས། །,སྐད་ཅིག་གཅིག་བྱས་སྡིག་པས་ཀྱང་། །བསྐལ་པར་མནར་མེད་གནས་འགྱུར་ན། །ཐོག་མེད་འཁོར་བར་བསགས་སྡིག་གིས། །བདེ་འགྲོར་མི་འགྲོ་སྨོས་ཅི་དགོས། །,"If even a single moment of negative action
Can lead to rebirth in the Avīci hell for an eon,
Then due to the negativity accumulated since beginningless samsara,
How could one possibly attain a fortunate rebirth?"
སྡིག་,misdeeds,སྡིག་དེ་དེ་རིང་སོ་སོར་བཤགས་བགྱི་ཡིས། །,དེ་བས་བདག་གིས་འགྲོ་ལ་གནོད་བྱས་པས། །ཐུགས་རྗེ་ཆེ་ཀུན་མི་དགྱེས་གྱུར་པ་གང་། །སྡིག་དེ་དེ་རིང་སོ་སོར་བཤགས་བགྱི་ཡིས། །མི་དགྱེས་གང་ལགས་དེ་ཐུབ་བཟོད་པར་གསོལ། །,"Therefore, due to the harm I have caused to beings,
Whatever displeasure I have brought to all the greatly compassionate ones,
I confess each of those misdeeds today.
For whatever displeasure I have caused, I beseech the Capable Ones for forbearance."
སྡིག་,negative karma,སྐྱེ་བ་གཞན་དུ་དེ་གོམས་ཤིང་། །སྡིག་དང་སྡུག་བསྔལ་འཕེལ་བར་འགྱུར། །,སྐྱེ་བ་གཞན་དུ་དེ་གོམས་ཤིང་། །སྡིག་དང་སྡུག་བསྔལ་འཕེལ་བར་འགྱུར། །གཞན་དང་འབྲས་བུའི་དུས་ཀྱང་ནི། །དམན་འགྱུར་དེ་ཡང་སྒྲུབ་མི་འགྱུར། །,"In future lives, one becomes habituated to abandoning virtue,
Thus increasing negative karma and suffering.
Moreover, both the other [virtuous action] and the time of its fruition
Become diminished, and even that is not accomplished."
སྡིག་,sin,སྒྱུ་མའི་སྐྱེས་བུ་བསད་སོགས་ལ། །སེམས་མེད་ཕྱིར་ན་སྡིག་མེད་དེ། །,སྒྱུ་མའི་སྐྱེས་བུ་བསད་སོགས་ལ། །སེམས་མེད་ཕྱིར་ན་སྡིག་མེད་དེ། །སྒྱུ་མའི་སེམས་དང་ལྡན་པ་ལ། །བསོད་ནམས་དང་ནི་སྡིག་པ་འབྱུང་། །,"When killing or harming an illusory person,
There's no sin, as they lack a mind.
For those possessing an illusory mind,
Both merit and sin can arise."
གོས་,cloths,དེ་དག་སྐུ་ལ་མཚུངས་པ་མེད་པའི་གོས། །གཙང་ལ་དྲི་རབ་བསྒོས་པས་སྐུ་ཕྱིའོ།,དེ་དག་སྐུ་ལ་མཚུངས་པ་མེད་པའི་གོས། །གཙང་ལ་དྲི་རབ་བསྒོས་པས་སྐུ་ཕྱིའོ། །དེ་ནས་དེ་ལ་ཁ་དོག་ལེགས་བསྒྱུར་བའི། །ན་བཟའ་ཤིན་ཏུ་དྲི་ཞིམ་དམ་པ་འབུལ། །,"Wipe their bodies with incomparable, clean cloths infused with fragrance.
Then offer them excellent robes of proper hue,
Supreme garments of most pleasant scent."
གོས་,clothes,བྲན་གཡོག་བཀོལ་དུ་མི་བཏུབ་ལའང་། །གོས་ལ་སོགས་པ་མི་སྦྱིན་ན། །,བྲན་གཡོག་བཀོལ་དུ་མི་བཏུབ་ལའང་། །གོས་ལ་སོགས་པ་མི་སྦྱིན་ན། །ལུས་འདི་བསྙོད་ཀྱང་གཞན་འགྲོ་ན། །ཁྱོད་ཀོ་ཅི་སྟེ་ཤ་ཐང་གསོ། །,"If you wouldn't give clothes and such to a servant unfit for work,
Why then do you exhaust yourself caring for this body?
Even if nourished, it will eventually depart for another realm."
གོས་,soiled,སྐྲག་པས་མི་གཙང་ལུས་གོས་ཤིང་། །,རང་སྡིག་དྲན་པས་གདུང་བ་དང་། །དམྱལ་བའི་སྒྲ་ནི་ཐོས་པ་ཡིས། །སྐྲག་པས་མི་གཙང་ལུས་གོས་ཤིང་། །མྱོས་པར་འགྱུར་ཚེ་ཅི་ཞིག་བྱ། །,"When tormented by remembering one's own misdeeds,
And upon hearing the sounds from the hells,
Frightened, with body soiled by impurities,
What can one do when intoxicated with suffering?"
གོས་,robes,ཀུན་ལ་མི་མཁོའི་གོས་འཆང་ཞིང་། །,ལྷུང་བཟེད་ལ་སོགས་ཉི་ཚེ་དང་། །ཀུན་ལ་མི་མཁོའི་གོས་འཆང་ཞིང་། །ལུས་འདི་སྦ་བ་མ་བྱས་ཀྱང་། །འཇིགས་མེད་གནས་པ་ནམ་ཞིག་འགྱུར། །,"When will I come to dwell fearlessly,
Keeping only an alms bowl and such simple things,
Wearing robes discarded by others,
Not even hiding this body, though exposed?"
གོས་,cloth,གོས་ཀྱིས་གདོང་ནི་གཡོགས་པར་གྱུར། །,གང་ཞིག་དང་པོ་འབད་དེ་བཏེག །དྲངས་ཀྱང་ངོ་ཚས་འོག་ཏུ་ལྟ། །སྔོན་ནི་མཐོང་ངམ་མ་མཐོང་ཡང་། །གོས་ཀྱིས་གདོང་ནི་གཡོགས་པར་གྱུར། །,"One who at first strives to look up,
Yet lowers their gaze out of modesty;
Whether seen before or not,
Their face becomes veiled by cloth."
རང་བཞིན་,nature,ཐུགས་རྗེའི་རང་བཞིན་ཅན་ལ་དབུལ་བར་བགྱི། །,གཞལ་མེད་ཕོ་བྲང་བསྟོད་དབྱངས་ཡིད་འོང་ལྡན། །མུ་ཏིག་རིན་ཆེན་རྒྱན་འཕྱང་མཛེས་འབར་བ། །དཔག་ཡས་ནམ་མཁའི་རྒྱན་གྱུར་དེ་དག་ཀྱང་། །ཐུགས་རྗེའི་རང་བཞིན་ཅན་ལ་དབུལ་བར་བགྱི། །,"To those of compassionate nature, I offer:
The immeasurable palace, filled with pleasing hymns of praise,
Adorned with hanging ornaments of pearls and precious gems, blazing with beauty,
And those countless celestial decorations that adorn the limitless sky."
རང་བཞིན་,naturally,རང་བཞིན་ཁ་ན་མ་ཐོའམ། །,བདག་ནི་མི་ཤེས་གཏི་མུག་པས། །རང་བཞིན་ཁ་ན་མ་ཐོའམ། །བཅས་པའི་སྡིག་པ་གང་ཡིན་ལས། །གང་ཡང་རུང་བ་བགྱིས་པ་རྣམས། །,"Due to my ignorance and delusion,
Whatever misdeeds I have committed,
Whether naturally wrong
Or wrong by precept,"
རང་བཞིན་,inherent nature,རང་བཞིན་འཆི་བས་སྡུག་བསྔལ་གྱུར་པའི་ཉོན་མོངས་དག །,རང་བཞིན་འཆི་བས་སྡུག་བསྔལ་གྱུར་པའི་ཉོན་མོངས་དག །གཡུལ་ངོར་མདར་ཚེ་ནན་གྱིས་གཞོམ་པར་འདོད་པ་ཡང་། །མདའ་མདུང་མཚོན་གྱིས་ཕོག་པའི་སྡུག་བསྔལ་ཁྱད་བསད་ནས། །དོན་མ་གྲུབ་པར་ཕྱིར་ཕྱོགས་འབྱེར་བར་མི་བྱེད་ན། །,"Those afflictions that cause suffering due to the inherent nature of death,
When wishing to forcefully destroy them in the heat of battle,
Even when struck by arrows, spears, and weapons, enduring the pain,
Do not turn back and flee without accomplishing the goal."
རང་བཞིན་,natural,རང་བཞིན་དགྲ་དེས་གཞོམ་བརྩོན་བདག་ལ་དེང་། །,རྟག་ཏུ་སྡུག་བསྔལ་ཀུན་གྱི་རྒྱུར་གྱུར་པ། །རང་བཞིན་དགྲ་དེས་གཞོམ་བརྩོན་བདག་ལ་དེང་། །སྡུག་བསྔལ་བརྒྱ་ཕྲག་རྒྱུར་གྱུར་གང་གིས་ཀྱང་། །ཡི་ཆད་སྒྱིད་ལུག་མི་འགྱུར་སྨོས་ཅི་དགོས། །,"Today, as I strive to defeat the natural enemy
That has always been the cause of all suffering,
Even if I face hundreds of sufferings as a result,
Need it be said that I will not become discouraged or disheartened?"
རང་བཞིན་,natural state,བསྒོས་པས་ལུས་ཀྱི་རང་བཞིན་ནི། །,གལ་ཏེ་སྐྲ་སེན་རིང་བ་དང་། །སོ་སྐྱ་དྲིར་བཅས་འདམ་གྱི་དྲིས། །བསྒོས་པས་ལུས་ཀྱི་རང་བཞིན་ནི། །གཅེར་བུ་འཇིགས་པ་ཉིད་ཡིན་ན། །,"If with long hair and nails,
Gray teeth emitting odor, smeared with muddy filth,
The body's natural state
Is naked and terrifying,"
རང་བཞིན་,natures,གཅིག་ལ་རང་བཞིན་གསུམ་ཉིད་ནི། །རིགས་མིན་དེས་ན་དེ་ཡོད་མིན། །,གཅིག་ལ་རང་བཞིན་གསུམ་ཉིད་ནི། །རིགས་མིན་དེས་ན་དེ་ཡོད་མིན། །དེ་བཞིན་ཡོན་ཏན་ཡོད་མིན་ཏེ། །དེ་ཡང་སོ་སོར་རྣམ་གསུམ་ཕྱིར། །,"It is unreasonable for a single entity to have three natures,
Therefore, such an entity does not exist.
Likewise, the qualities do not exist,
For each of them would also be threefold."
ཐམས་ཅད་,all,།ཤིན་ཏུ་མི་བཟད་བགྱིས་པ་དེ། །ཐམས་ཅད་འདྲེན་པ་རྣམས་ལ་བཤགས། །,ཉེས་པ་དུ་མས་སྐྱོན་ཆགས་པའི། །སྡིག་ཅན་བདག་གིས་སྡིག་པ་གང་། །ཤིན་ཏུ་མི་བཟད་བགྱིས་པ་དེ། །ཐམས་ཅད་འདྲེན་པ་རྣམས་ལ་བཤགས། །,"I, a sinner afflicted with numerous faults,
Confess to all the guides (enlightened beings)
All the negative actions I have committed
That are utterly unbearable in their consequences."
ཐམས་ཅད་,everything,ཐམས་ཅད་བོར་ཏེ་ཆས་དགོས་པར། །,ཐམས་ཅད་བོར་ཏེ་ཆས་དགོས་པར། །བདག་གིས་དེ་ལྟར་མ་ཤེས་ནས། །མཛའ་དང་མི་མཛའི་དོན་གྱི་ཕྱིར། །སྡིག་པ་རྣམ་པ་སྣ་ཚོགས་བྱས། །,"Not knowing that I must depart leaving everything behind,
I have committed various sins
For the sake of friends and enemies."
ཐམས་ཅད་,everyone,བདེ་དང་སྡུག་བསྔལ་མཉམ་པས་ན། །ཐམས་ཅད་བདག་བཞིན་བསྲུང་བར་བྱ། །,བདག་དང་གཞན་དུ་མཉམ་པ་ནི། །དང་པོ་ཉིད་དུ་འབད་དེ་བསྒོམ། །བདེ་དང་སྡུག་བསྔལ་མཉམ་པས་ན། །ཐམས་ཅད་བདག་བཞིན་བསྲུང་བར་བྱ། །,"Equalizing self and others
Should be practiced first with diligence.
Since all are equal in joy and sorrow,
One should protect everyone as oneself."
ཐམས་ཅད་,always,ཐམས་ཅད་ཚེ་ན་སྒྲ་འཛིན་འགྱུར། །,གལ་ཏེ་སྒྲ་ཡི་ཤེས་རྟག་ན། །ཐམས་ཅད་ཚེ་ན་སྒྲ་འཛིན་འགྱུར། །ཤེས་བྱ་མེད་ན་ཅི་ཞིག་རིག །གང་གིས་ཤེས་པ་ཞེས་རྗོད་བྱེད། །,"If the consciousness of sound were permanent,
It would always perceive sound.
When there is no object to be known, what does it cognize?
On what basis is it called consciousness?"
ཐམས་ཅད་,All things,ཐམས་ཅད་ནམ་མཁའ་འདྲ་བར་ནི། །བདག་འདྲས་ཡོངས་སུ་གཟུང་བར་གྱིས།,ཐམས་ཅད་ནམ་མཁའ་འདྲ་བར་ནི། །བདག་འདྲས་ཡོངས་སུ་གཟུང་བར་གྱིས། །བདག་ཉིད་བདེ་བར་འདོད་རྣམས་ནི། །འཐབ་དང་སྤྲོ་བའི་རྒྱུ་དག་གིས། །,"All things are like the sky;
Let those like myself fully grasp this.
Those who desire happiness for themselves
Through causes of conflict and enthusiasm."
ཉོན་མོངས་,afflicted states,ཉོན་མོངས་སྒོ་ནས་ལུས་ངག་དང་། །,བདག་གིས་དཀོན་མཆོག་གསུམ་དང་ནི། །ཕ་མའམ་བླ་མ་གཞན་དག་ལ། །ཉོན་མོངས་སྒོ་ནས་ལུས་ངག་དང་། །ཡིད་ཀྱིས་གནོད་བགྱིས་གང་ལགས་དང་། །,"Whatever harm I have done through body, speech, and mind,
Driven by afflicted states,
To the Three Jewels, my parents, teachers,
Or any others - [I confess]."
ཉོན་མོངས་,afflictions,།འགྲོ་བའི་ཉོན་མོངས་གདུང་སེལ་བའི། །སེམས་ཀྱི་ཟླ་བ་ཤར་བ་ཡིན།,འགྲོ་བ་ཐམས་ཅད་ངན་འགྲོ་ལས། །སྒྲོལ་བར་བྱེད་པའི་སྤྱི་སྟེགས་ཡིན། །འགྲོ་བའི་ཉོན་མོངས་གདུང་སེལ་བའི། །སེམས་ཀྱི་ཟླ་བ་ཤར་བ་ཡིན། །,"It is the universal platform that liberates
All beings from the lower realms.
It is the rising of the mind's moon
That dispels the burning afflictions of beings."
ཉོན་མོངས་,afflictive emotions,བདག་གི་ཉོན་མོངས་དགྲ་བོ་གང་། །དུས་རིང་ཐོག་མཐའ་མེད་པ་ལྟར། །,བདག་གི་ཉོན་མོངས་དགྲ་བོ་གང་། །དུས་རིང་ཐོག་མཐའ་མེད་པ་ལྟར། །དགྲ་གཞན་ཀུན་ཀྱང་དེ་ལྟ་བུར། །ཡུན་རིང་ཐུབ་པ་མ་ཡིན་ནོ། །,"My afflictive emotions, which are my enemies,
Seem to have no beginning or end, lasting for eons.
No other foes can persist
For such an extended time."
