Word,Translation,Context,Source,Source Translation
བདེ་གཤེགས་,Sugatas,བདེ་གཤེགས་ཆོས་ཀྱི་སྐུ་མངའ་སྲས་བཅས་དང་།,བདེ་གཤེགས་ཆོས་ཀྱི་སྐུ་མངའ་སྲས་བཅས་དང་། །ཕྱག་འོས་ཀུན་ལའང་གུས་པར་ཕྱག་འཚལ་ཏེ། །བདེ་གཤེགས་སྲས་ཀྱི་སྡོམ་ལ་འཇུག་པ་ནི། །ལུང་བཞིན་མདོར་བསྡུས་ནས་ནི་བརྗོད་པར་བྱ། །,"I respectfully bow to the Sugatas who possess the Dharma body, together with their Sons,
And to all who are worthy of veneration.
I shall explain how to engage in the vows of the Sons of the Sugatas,
In brief, according to the scriptures."
བདེ་གཤེགས་,Buddha,།བདེ་གཤེགས་བསླབ་པ་དྲན་བྱས་ནས། །སྐྲག་པས་དེ་ཡི་མོད་ལ་དོར།,དོན་མེད་ས་རྐོ་རྩྭ་གཅོད་དང་། །ས་རིས་འདྲི་སོགས་བྱེད་གྱུར་ན། །བདེ་གཤེགས་བསླབ་པ་དྲན་བྱས་ནས། །སྐྲག་པས་དེ་ཡི་མོད་ལ་དོར། །,"If you engage in pointless activities such as digging the earth, cutting grass, or drawing on the ground, recall the precepts of the Buddha. Out of fear [of transgression], immediately abandon such actions."
བདེ་གཤེགས་,Sugata,བསྐལ་པ་སྟོང་དུ་བསགས་པ་ཡི། །སྦྱིན་དང་བདེ་གཤེགས་མཆོད་ལ་སོགས།,བསྐལ་པ་སྟོང་དུ་བསགས་པ་ཡི། །སྦྱིན་དང་བདེ་གཤེགས་མཆོད་ལ་སོགས། །ལེགས་སྤྱད་གང་ཡིན་དེ་ཀུན་ཡང་། །ཁོང་ཁྲོ་གཅིག་གིས་འཇོམས་པར་བྱེད། །,"The generosity and offerings to the Sugatas
Accumulated over a thousand eons,
And whatever good conduct there may be—
All of these are destroyed by a single moment of anger."
བདེ་གཤེགས་,Tathagatas,རྒྱལ་བའི་མདུན་གནས་བདེ་གཤེགས་སྲས་སུ་དགེ་བས་འགྱུར། །,རྒྱ་ཆེ་དྲི་བཟང་བསིལ་བའི་པདྨའི་སྙིང་པོར་གནས། །རྒྱལ་བའི་གསུང་སྙན་ཟས་ཀྱིས་གཟི་བརྗིད་བསྐྱེད་བྱས་པ། །ཐུབ་འོད་ཀྱིས་རྒྱས་པདྨ་ལས་བྱུང་ལུས་མཆོག་ཅན། །རྒྱལ་བའི་མདུན་གནས་བདེ་གཤེགས་སྲས་སུ་དགེ་བས་འགྱུར། །,"Dwelling in the heart of a vast, fragrant, and cool lotus,
Nourished and made resplendent by the Buddha's sweet speech as sustenance,
Emerging from a lotus expanded by the Sage's light, with a supreme body,
One becomes a child of the Tathagatas, present before the Victorious Ones, through virtue."
བདེ་གཤེགས་,Blissfully Gone Ones,གཞལ་མེད་ཁང་གྱུར་བདེ་གཤེགས་གང་བར་ཤོག །,སོལ་ཕུང་དེ་དག་རིན་ཆེན་ཕུང་པོར་གྱུར། །ས་བསྲེགས་ཤེལ་གྱི་ས་གཞི་བསྟར་བར་ཤོག །བསྡུས་འཇོམས་རི་བོ་རྣམས་ཀྱང་མཆོད་པ་ཡི། །གཞལ་མེད་ཁང་གྱུར་བདེ་གཤེགས་གང་བར་ཤོག །,"May the heaps of burning coals transform into mounds of precious gems.
May the scorching iron ground become a vast expanse of crystal.
May the crushing mountains turn into immeasurable offering palaces,
Filled with the presence of the Blissfully Gone Ones."
སྲས་,Sons,བདེ་གཤེགས་ཆོས་ཀྱི་སྐུ་མངའ་སྲས་བཅས་དང་།,བདེ་གཤེགས་ཆོས་ཀྱི་སྐུ་མངའ་སྲས་བཅས་དང་། །ཕྱག་འོས་ཀུན་ལའང་གུས་པར་ཕྱག་འཚལ་ཏེ། །བདེ་གཤེགས་སྲས་ཀྱི་སྡོམ་ལ་འཇུག་པ་ནི། །ལུང་བཞིན་མདོར་བསྡུས་ནས་ནི་བརྗོད་པར་བྱ། །,"I respectfully bow to the Sugatas who possess the Dharma body, together with their Sons,
And to all who are worthy of veneration.
I shall explain how to engage in the vows of the Sons of the Sugatas,
In brief, according to the scriptures."
སྲས་,children,བདེ་གཤེགས་རྣམས་ཀྱི་སྲས་ཞེས་བརྗོད་བྱ་ཞིང་། །,བྱང་ཆུབ་སེམས་སྐྱེས་གྱུར་ན་སྐད་ཅིག་གིས། །འཁོར་བའི་བཙོན་རར་བསྡམས་པའི་ཉམ་ཐག་རྣམས། །བདེ་གཤེགས་རྣམས་ཀྱི་སྲས་ཞེས་བརྗོད་བྱ་ཞིང་། །འཇིག་རྟེན་ལྷ་མིར་བཅས་པས་ཕྱག་བྱར་འགྱུར། །,"When bodhicitta arises, in an instant,
Those wretched ones bound in samsara's prison
Are called children of the Sugatas,
And become worthy of prostration by gods and humans of the world."
སྲས་,disciples,བློ་ཡིས་བླངས་ནས་ཐུབ་པ་སྐྱེས་ཀྱི་མཆོག །སྲས་དང་བཅས་པ་རྣམས་ལ་ལེགས་འབུལ་ན།,བློ་ཡིས་བླངས་ནས་ཐུབ་པ་སྐྱེས་ཀྱི་མཆོག །སྲས་དང་བཅས་པ་རྣམས་ལ་ལེགས་འབུལ་ན། །ཡོན་གནས་དམ་པ་ཐུགས་རྗེ་ཆེ་རྣམས་ཀྱིས། །བདག་ལ་བརྩེར་དགོངས་བདག་གི་འདི་དག་བཞེས། །,"Having mentally gathered offerings, I properly present them to the Supreme Sage and his disciples. May you noble recipients, endowed with great compassion, kindly consider me with love and accept these offerings of mine."
སྲས་,spiritual son,དེ་བཞིན་གཤེགས་དང་དེ་ཡི་སྲས་རྣམས་ལ།,དེ་བཞིན་གཤེགས་དང་དེ་ཡི་སྲས་རྣམས་ལ། །རིན་ཆེན་བུམ་པ་མང་པོ་སྤོས་ཀྱི་ཆུ། །ཡིད་འོང་ལེགས་པར་བཀང་བ་གླུ་དང་ནི། །རོལ་མོར་བཅས་པ་དུ་མས་སྐུ་ཁྲུས་གསོལ། །,"To the Tathagatas and their spiritual sons,
I offer a bath with many precious vessels
Filled with fragrant, pleasing water and flowers,
Accompanied by numerous songs and musical instruments."
སྲས་,heirs,དེ་བཞིན་བདག་གིས་དེ་བཞིན་གཤེགས། །མགོན་པོ་སྲས་དང་བཅས་རྣམས་མཆོད། །,ཇི་ལྟར་འཇམ་དབྱངས་ལ་སོགས་པས། །རྒྱལ་བ་རྣམས་ལ་མཆོད་མཛད་པ། །དེ་བཞིན་བདག་གིས་དེ་བཞིན་གཤེགས། །མགོན་པོ་སྲས་དང་བཅས་རྣམས་མཆོད། །,"Just as Manjushri and others
Make offerings to the Victorious Ones,
In the same way, I too shall offer
To the Tathagatas, protectors, and their heirs."
སྲས་,child,རྒྱལ་བའི་མདུན་གནས་བདེ་གཤེགས་སྲས་སུ་དགེ་བས་འགྱུར། །,རྒྱ་ཆེ་དྲི་བཟང་བསིལ་བའི་པདྨའི་སྙིང་པོར་གནས། །རྒྱལ་བའི་གསུང་སྙན་ཟས་ཀྱིས་གཟི་བརྗིད་བསྐྱེད་བྱས་པ། །ཐུབ་འོད་ཀྱིས་རྒྱས་པདྨ་ལས་བྱུང་ལུས་མཆོག་ཅན། །རྒྱལ་བའི་མདུན་གནས་བདེ་གཤེགས་སྲས་སུ་དགེ་བས་འགྱུར། །,"Dwelling in the heart of a vast, fragrant, and cool lotus,
Nourished and made resplendent by the Buddha's sweet speech as sustenance,
Emerging from a lotus expanded by the Sage's light, with a supreme body,
One becomes a child of the Tathagatas, present before the Victorious Ones, through virtue."
བརྗོད་,said,སྔོན་ཆད་མ་བྱུང་བ་ཡང་འདིར་བརྗོད་མེད། །,སྔོན་ཆད་མ་བྱུང་བ་ཡང་འདིར་བརྗོད་མེད། །སྡེབ་སྦྱོར་མཁས་པའང་བདག་ལ་ཡོད་མིན་ཏེ། །དེ་ཕྱིར་གཞན་དོན་བསམ་པ་བདག་ལ་མེད། །རང་གི་ཡིད་ལ་བསྒོམ་ཕྱིར་ངས་འདི་བརྩམས། །,"There is nothing said here that has not been said before,
Nor do I possess skill in composition.
Therefore, I have no intention to benefit others;
I have composed this to cultivate my own mind."
བརྗོད་,say,འགའ་ཞིག་མིག་ལམ་སྣང་གྱུར་ན། །བལྟས་ནས་འོངས་པ་ལེགས་ཞེས་བརྗོད། །,ལྟ་བ་ངལ་བསོའི་ཆེད་དུ་ནི། །རེས་འགའ་ཕྱོགས་སུ་བལྟ་བར་བྱ། །འགའ་ཞིག་མིག་ལམ་སྣང་གྱུར་ན། །བལྟས་ནས་འོངས་པ་ལེགས་ཞེས་བརྗོད། །,"To rest one's gaze, occasionally look around.
If someone appears in your line of sight,
Look at them and say, ""It's good that you've come."""
བརྗོད་,praise,ལྐོག་ན་ཡོན་ཏན་བརྗོད་བྱ་ཞིང་།,ལྐོག་ན་ཡོན་ཏན་བརྗོད་བྱ་ཞིང་། །ཡོན་ཏན་བརྗོད་ན་རྗེས་སུ་བརྗོད། །རང་གི་ཡོན་ཏན་བརྗོད་ན་དེ། །ཡོན་ཏན་ཤེས་པར་རིག་པར་བྱ། །,"Praise qualities in one's absence,
And when qualities are praised, join in the praise.
When speaking of one's own qualities,
Recognize them as virtues without pride."
བརྗོད་,speaking,།རང་གི་ཡོན་ཏན་བརྗོད་ན་དེ།,ལྐོག་ན་ཡོན་ཏན་བརྗོད་བྱ་ཞིང་། །ཡོན་ཏན་བརྗོད་ན་རྗེས་སུ་བརྗོད། །རང་གི་ཡོན་ཏན་བརྗོད་ན་དེ། །ཡོན་ཏན་ཤེས་པར་རིག་པར་བྱ། །,"Praise qualities in one's absence,
And when qualities are praised, join in the praise.
When speaking of one's own qualities,
Recognize them as virtues without pride."
བརྗོད་,speak,གཞན་ལ་མི་སྙན་བརྗོད་ལའང་ཁྱོད། །དེ་བཞིན་ཅི་སྟེ་ཁྲོ་མི་བྱེད། །,གལ་ཏེ་སེམས་ཅན་ཉམས་བྱེད་པས། །མི་སྙན་སྨྲ་ལ་ཁྲོ་ཞེ་ན། །གཞན་ལ་མི་སྙན་བརྗོད་ལའང་ཁྱོད། །དེ་བཞིན་ཅི་སྟེ་ཁྲོ་མི་བྱེད། །,"If you become angry at those who harm sentient beings
By speaking unpleasantly about you,
Why then do you not similarly become angry
At those who speak unpleasantly about others?"
བརྗོད་,spoken,མི་སྙན་བརྗོད་ན་ཁོང་ཁྲོ་སྐྱེ། །,མཐོ་ལ་ཕྲག་དོག་མཉམ་དང་འགྲན། །དམའ་ལ་ང་རྒྱལ་བསྟོད་ན་དྲེགས། །མི་སྙན་བརྗོད་ན་ཁོང་ཁྲོ་སྐྱེ། །ནམ་ཞིག་བྱིས་ལས་ཕན་པ་ཐོབ།,"Envy the high and compete with equals,
Show pride to the low and become arrogant when praised.
Anger arises when unpleasant words are spoken.
When will benefit ever come from such childish behavior?"
བརྗོད་,declares,བློ་ནི་གསལ་བ་ཉིད་ཡིན་ཞེས། །གང་གིས་ཤེས་ནས་དེ་སྐད་བརྗོད། །,མར་མེ་གསལ་བར་བྱེད་དོ་ཞེས། །ཤེས་པས་ཤེས་ཏེ་རྗོད་བྱེད་ན། །བློ་ནི་གསལ་བ་ཉིད་ཡིན་ཞེས། །གང་གིས་ཤེས་ནས་དེ་སྐད་བརྗོད། །,"If one says, understanding through knowledge,
""A lamp illuminates itself,""
Then who understands and declares
That consciousness itself is luminous?"
བརྗོད་,described,དེ་ན་བརྗོད་ཀྱང་དོན་མེད་དོ། །,གང་ཚེ་འགས་ཀྱང་མཐོང་མིན་ན། །གསལ་བའམ་ནི་མི་གསལ་བ། །མོ་གཤམ་བུ་མོའི་འགྱིང་བག་བཞིན། །དེ་ན་བརྗོད་ཀྱང་དོན་མེད་དོ། །,"When [consciousness] is not seen by anyone,
Whether clear or unclear,
Like the grace of a barren woman's daughter,
Even if described, it is meaningless."
མཁས་པ་,skill,སྡེབ་སྦྱོར་མཁས་པའང་བདག་ལ་ཡོད་མིན་ཏེ། །,སྔོན་ཆད་མ་བྱུང་བ་ཡང་འདིར་བརྗོད་མེད། །སྡེབ་སྦྱོར་མཁས་པའང་བདག་ལ་ཡོད་མིན་ཏེ། །དེ་ཕྱིར་གཞན་དོན་བསམ་པ་བདག་ལ་མེད། །རང་གི་ཡིད་ལ་བསྒོམ་ཕྱིར་ངས་འདི་བརྩམས། །,"There is nothing said here that has not been said before,
Nor do I possess skill in composition.
Therefore, I have no intention to benefit others;
I have composed this to cultivate my own mind."
མཁས་པ་,wise person,དེ་བཞིན་མཁས་པས་འདི་གཉིས་ཀྱི། །,འགྲོ་བར་འདོད་དང་འགྲོ་བ་ཡི། །བྱེ་བྲག་ཇི་ལྟར་ཤེས་པ་ལྟར། །དེ་བཞིན་མཁས་པས་འདི་གཉིས་ཀྱི། །བྱེ་བྲག་རིམ་བཞིན་ཤེས་པར་བྱ། །,"Just as one understands the difference
Between wishing to go and actually going,
So should the wise person understand
The distinction between these two in sequence."
མཁས་པ་,wise ones,དེ་ལྟར་གནས་པའི་མཁས་པ་ལ། །བསོད་ནམས་མི་འགྱུར་གང་ཡང་མེད། །,རྒྱལ་སྲས་རྣམས་ཀྱིས་མི་བསླབ་པ། །དེ་ནི་གང་ཡང་ཡོད་མིན་ཏེ། །དེ་ལྟར་གནས་པའི་མཁས་པ་ལ། །བསོད་ནམས་མི་འགྱུར་གང་ཡང་མེད། །,"There is nothing that the sons of the conquerors should not learn.
For the wise ones who abide in such a way,
There is nothing that does not become meritorious."
མཁས་པ་,skilled,ཐེག་ཆེན་དོན་ལ་མཁས་པ་དང་། །,རྟག་པར་དགེ་བའི་བཤེས་གཉེན་ནི། །ཐེག་ཆེན་དོན་ལ་མཁས་པ་དང་། །བྱང་ཆུབ་སེམས་དཔའི་བརྟུལ་ཞུགས་མཆོག །སྲོག་གི་ཕྱིར་ཡང་མི་བཏང་ངོ་། །,"Always rely on a virtuous spiritual friend
Who is skilled in the meaning of the Great Vehicle
And supreme in the discipline of bodhisattvas.
Do not abandon them even at the cost of your life."
མཁས་པ་,wise,མཁས་པས་སྡུག་བསྔལ་བྱུང་ཡང་ནི། །,མཁས་པས་སྡུག་བསྔལ་བྱུང་ཡང་ནི། །སེམས་ཀྱི་རབ་དང་རྙོག་མི་བྱ། །ཉོན་མོངས་རྣམས་དང་གཡུལ་འགྱེད་ལ། །གཡུལ་འགྱེད་ཚེ་ན་གནོད་པ་མང་། །,"Even when suffering arises, the wise do not disturb
The clarity and calmness of their minds.
When battling against afflictions,
Many harms occur during the conflict."
མཁས་པ་,wisdom,མཁས་པའི་ཕྱིར་ན་མི་དགའ་མེད། །,སྡིག་པ་སྤང་ཕྱིར་སྡུག་བསྔལ་མེད། །མཁས་པའི་ཕྱིར་ན་མི་དགའ་མེད། །འདི་ལྟར་ལོག་པར་རྟོག་པ་དང་། །སྡིག་པས་སེམས་དང་ལུས་ལ་གནོད། །,"By abandoning negative actions, there is no suffering.
Due to wisdom, there is no dissatisfaction.
Thus, misconceptions
And negative actions harm both mind and body."
བདག་,I,སྡེབ་སྦྱོར་མཁས་པའང་བདག་ལ་ཡོད་མིན་ཏེ། །,སྔོན་ཆད་མ་བྱུང་བ་ཡང་འདིར་བརྗོད་མེད། །སྡེབ་སྦྱོར་མཁས་པའང་བདག་ལ་ཡོད་མིན་ཏེ། །དེ་ཕྱིར་གཞན་དོན་བསམ་པ་བདག་ལ་མེད། །རང་གི་ཡིད་ལ་བསྒོམ་ཕྱིར་ངས་འདི་བརྩམས། །,"There is nothing said here that has not been said before,
Nor do I possess skill in composition.
Therefore, I have no intention to benefit others;
I have composed this to cultivate my own mind."
བདག་,my,དགེ་བ་བསྒོམ་ཕྱིར་བདག་གི་དད་པའི་ཤུགས། །,དགེ་བ་བསྒོམ་ཕྱིར་བདག་གི་དད་པའི་ཤུགས། །འདི་དག་གིས་ཀྱང་རེ་ཞིག་འཕེལ་འགྱུར་ལ། །བདག་དང་སྐལ་བ་མཉམ་པ་གཞན་གྱིས་ཀྱང་། །ཅི་སྟེ་འདི་དག་མཐོང་ན་དོན་ཡོད་འགྱུར། །,"In order to cultivate virtue, may the force of my faith
Be increased, at least for now, by these [writings].
And should others of equal fortune
Happen to see these, may it become meaningful for them as well."
བདག་,me,།བདག་ལ་བརྩེར་དགོངས་བདག་གི་འདི་དག་བཞེས།,བློ་ཡིས་བླངས་ནས་ཐུབ་པ་སྐྱེས་ཀྱི་མཆོག །སྲས་དང་བཅས་པ་རྣམས་ལ་ལེགས་འབུལ་ན། །ཡོན་གནས་དམ་པ་ཐུགས་རྗེ་ཆེ་རྣམས་ཀྱིས། །བདག་ལ་བརྩེར་དགོངས་བདག་གི་འདི་དག་བཞེས། །,"Having mentally gathered offerings, I properly present them to the Supreme Sage and his disciples. May you noble recipients, endowed with great compassion, kindly consider me with love and accept these offerings of mine."
བདག་,myself,།དགེ་བ་བདག་གིས་མ་བྱས་ན། །,གང་ཚེ་དགེ་སྤྱད་སྐལ་ལྡན་ཡང་། །དགེ་བ་བདག་གིས་མ་བྱས་ན། །ངན་སོང་སྡུག་བསྔལ་ཀུན་རྨོངས་པ། །དེ་ཚེ་བདག་གིས་ཅི་བྱར་ཡོད། །,"When I have the fortune to perform virtuous deeds,
If I do not engage in virtue myself,
Later, confused by the sufferings of lower realms,
What will I be able to do then?"
བདག་,"['I', 'myself']",བདག་ལ་འདིར་སེམས་མེད་དུ་ཟད། །,སྔགས་ཀྱིས་རྨོངས་པར་བྱས་པ་བཞིན། །བདག་ལ་འདིར་སེམས་མེད་དུ་ཟད། །ཅིས་རྨོངས་བདག་ཀྱང་མ་ཤེས་ཏེ། །བདག་གི་ཁོང་ན་ཅི་ཞིག་ཡོད། །,"Like one bewildered by a spell,
I find myself here, devoid of mind.
How I became deluded, I do not know.
What could be within me causing this?"
བདག་,oneself,ཁ་ན་མ་ཐོ་མེད་དངོས་ལ། །བདག་དང་སེམས་ཅན་དབང་བྱས་ཤིང་། །,ཁ་ན་མ་ཐོ་མེད་དངོས་ལ། །བདག་དང་སེམས་ཅན་དབང་བྱས་ཤིང་། །སྤྲུལ་པ་བཞིན་དུ་ང་མེད་པར། །ཡིད་འདི་རྟག་ཏུ་གཟུང་བར་བྱ། །,"In faultless situations,
Considering oneself and sentient beings,
Like an emanation, without ego,
One should always maintain this mindset."
བདག་,self,གཙོ་བོ་ཞེས་བྱར་གང་འདོད་དང་། །བདག་ཅེས་བརྟགས་པ་གང་ཡིན་པ། །,གཙོ་བོ་ཞེས་བྱར་གང་འདོད་དང་། །བདག་ཅེས་བརྟགས་པ་གང་ཡིན་པ། །དེ་ཉིད་བདག་ནི་འབྱུང་བྱ་ཞེས། །ཆེད་དུ་བསམས་ཤིང་འབྱུང་བ་མེད། །,"That which is desired as the ""principal"" and that which is conceptualized as the ""self"" - this very self does not arise thinking, ""I shall arise,"" nor does it actually arise."
བདག་,Himself,བདག་ཏུ་མཛད་པ་འདི་ལ་ཐེ་ཚོམ་མེད། །,འགྲོ་བ་འདི་ཀུན་ཐུགས་རྗེའི་བདག་ཅན་དེས། །བདག་ཏུ་མཛད་པ་འདི་ལ་ཐེ་ཚོམ་མེད། །སེམས་ཅན་ངོ་བོར་མཐོང་བ་འདི་དག་ཉིད། །མགོན་དེ་བདག་ཉིད་ཅི་ཕྱིར་གུས་མི་བྱེད། །,"All these beings are the embodiment of the Compassionate One's mind;
There is no doubt that He regards them as Himself.
Seeing these very beings in their true nature,
Why do I not show respect to the Protector Himself?"
བདག་,"['me', 'mine']",གལ་ཏེ་བདག་གི་སྡུག་བསྔལ་གྱིས། །གཞན་གྱི་ལུས་ལ་མི་གནོད་པ། །,གལ་ཏེ་བདག་གི་སྡུག་བསྔལ་གྱིས། །གཞན་གྱི་ལུས་ལ་མི་གནོད་པ། །དེ་ལྟའང་དེ་བདག་སྡུག་བསྔལ་དེ། །བདག་ཏུ་ཞེན་པས་མི་བཟོད་ཉིད། །,"Although my suffering does not harm others' bodies,
Still, this very suffering of mine
Is unbearable to me
Due to my attachment to self."
བདག་,one's own,གལ་ཏེ་བཟློག་ནའང་ཐམས་ཅད་བཟློག །དེ་མིན་བདག་ཀྱང་སེམས་ཅན་བཞིན། །,ཅི་ཕྱིར་ཀུན་གྱི་སྡུག་བསྔལ་ནི། །བཟློག་པར་བྱ་ཞེས་བརྩད་དུ་མེད། །གལ་ཏེ་བཟློག་ནའང་ཐམས་ཅད་བཟློག །དེ་མིན་བདག་ཀྱང་སེམས་ཅན་བཞིན། །,"Why is there no debate about alleviating everyone's suffering?
If suffering is to be eliminated, then all of it should be eliminated.
If not, then even one's own suffering, like that of other beings, should not be eliminated."
